target,emotion_intensity,sombre,content,calm,uneasy,num_colours,num_objects,willing_to_pay,season_Spring,season_Summer,season_Fall,season_Winter,room_Bedroom,room_Bathroom,room_Office,room_Living_room,room_Dining_room,view_Friends,view_Family_members,view_Coworkers_Classmates,view_Strangers,view_By_yourself,feeling_desc,food,soundtrack
1,9.0,1.0,5.0,4.0,1.0,3.0,3.0,30.0,1,1,0,0,0,0,0,1,0,1,1,1,0,1,"Curious, in awe and lively",A good hamburger,Mystical and magical
1,8.0,4.0,2.0,3.0,1.0,4.0,14.0,400.0,1,1,0,0,1,0,1,1,1,1,1,1,0,0,"This painting makes me feel a bit confused, as in a little hazy, and maybe even a bit sad due to the way Vincent van Gogh has used the brush strokes to create that effect. ",This painting would be ramen.,A sad sound which really allows a person to express all their emotions.
1,9.0,4.0,2.0,2.0,3.0,3.0,4.0,800.0,1,0,1,0,0,0,1,0,0,1,0,0,0,1,It gives me a sense of awe mixed with a little bit of anxiety because everything is swirling so fast.,waffles with blueberries,"A classical orchestral piece dominated by violins playing fast, swirling scales"
1,4.0,4.0,2.0,3.0,4.0,4.0,6.0,67.0,0,0,0,1,0,1,0,1,1,1,1,0,0,1,"familiar, sombre, calm, longing",noodles,505 by Arctic Monkeys
1,6.0,2.0,5.0,4.0,2.0,3.0,2.0,100.0,1,1,0,0,1,1,0,1,1,1,0,1,0,1,This painting makes me feel bright. It makes me feel cool like a Saturday night. This painting brings me excitement but also calmness. It makes me feel like going out or travelling. It has a familiar exciting comforting vibe.,Soup. Some kind of hearty food with a good prominent taste. Definitely a more wet food.,This would definitely have the piano in most of its songs. The songs would be at a higher pitch. It could have some more calm songs and some more poppy songs. The genre would be some kind of pop or electric.
1,4.0,4.0,4.0,5.0,1.0,3.0,3.0,3.0,0,0,1,0,0,1,0,1,0,1,1,1,1,0,Calm,Soup,A smooth jazz song
1,1.0,1.0,1.0,1.0,1.0,6.0,3.0,0.01,0,1,0,0,0,1,0,0,0,0,0,0,1,1,"This feeling makes me feel neutral, and doesn't make me feel much.","Something boring - so maybe something like, noodles.","Escapism, by Raye."
1,4.0,4.0,4.0,4.0,2.0,4.0,4.0,20.0,0,1,0,0,1,0,0,0,0,1,0,0,0,0,awestruck,pasta,hopefull
1,9.0,4.0,4.0,3.0,3.0,5.0,6.0,1500.0,0,0,0,1,0,0,0,1,0,1,0,0,0,0,"It makes me feel emotional in a deep way. There’s a mix of calm and chaos, as if everything is moving, but somehow it still feels peaceful. It feels introspective and makes me think a lot.","A comforting, warm meal on a cold night, but with strong flavours that would stay with you for long/","Flowing music with rising and falling intensity, like waves of sound. It would feel emotional and expressive, with moments of calm followed by bursts of energy."
1,6.0,2.0,4.0,4.0,2.0,3.0,2.0,200.0,0,0,0,1,1,0,0,0,0,0,1,0,0,1,"This painting makes me feel relaxed, like another day has gone by and things are going to be okay.",Soup,"An emotional soundtrack; relaxing, dreamy and melancholic."
1,10.0,1.0,5.0,3.0,2.0,2.0,5.0,200.0,1,1,0,0,0,0,0,1,0,1,1,1,0,0,"Happy, Party night",Sushi,Happy Piano and violin 
1,8.0,2.0,4.0,1.0,4.0,2.0,2.0,2.0,0,0,0,1,0,0,0,1,0,1,0,0,0,1,confused,blueberry smoothie,"slow, dark, in some minor key."
1,7.0,4.0,3.0,4.0,2.0,4.0,3.0,50.0,0,0,1,1,1,1,1,1,0,1,1,0,0,1,Makes me feel calm,buegwe,calming sound track
1,2.0,2.0,3.0,4.0,2.0,3.0,2.0,80.0,0,0,0,1,1,0,0,0,0,0,0,0,1,0,"I feel pretty neutral about it overall. The blue tones and the way everything kind of moves reminds me of the ocean, so it feels calming in that sense, but not in a super strong way.",Blueberry muffin,"I imagine something slow and repetitive. Not much happening at once, just sounds that blend together and feel smooth. It would be calming and easy to listen to without really focusing on it."
1,7.0,3.0,4.0,5.0,1.0,3.0,3.0,20.0,1,0,0,0,0,0,0,1,1,1,0,0,0,1,Makes me feel a sense of calm wonder. ,blueberry,Sounds like the song city of stars 
1,7.0,2.0,5.0,5.0,1.0,3.0,3.0,500.0,0,0,0,1,0,0,0,1,0,1,1,0,0,0,It makes me feel happy.,Blueberry pie,Fast and energetic but a little creepy.
1,7.0,4.0,2.0,2.0,3.0,5.0,4.0,30.0,0,0,0,1,0,1,0,1,0,1,1,0,0,0,It makes me feel cold and gloomy.,Ice cream,it would be a very sad soundtrack.
1,5.0,3.0,4.0,3.0,5.0,3.0,2.0,400.0,1,0,0,1,1,0,0,0,0,1,1,0,0,1,scared,spaghetti ,eerie pipe organ 
1,8.0,3.0,4.0,4.0,2.0,5.0,3.0,1000.0,1,0,0,0,0,0,0,1,0,0,0,0,0,1,It makes me feel awe and wonderful about how beautiful the night sky could be. ,Blueberry ice-cream. ,"It sounds magical, like out of Harry Potter. A lot of glockenspiel and bells. "
1,8.0,4.0,4.0,4.0,2.0,2.0,2.0,600.0,0,1,0,0,1,0,0,0,0,0,1,0,0,1,"In a lot of awe and wonder at how large the universe is and just how small we are. Also lots of memories of camping in places where there's no light pollution. The crisp cold air hitting my lungs. You really feel sense of profound sadness, to be honest, it's like nothing matters in the grand scheme of things. ",Pomegranates,Choir singing or just any large group of people singing together.
1,7.0,4.0,3.0,4.0,4.0,5.0,5.0,500.0,0,1,0,0,1,0,0,1,0,0,0,0,0,1,"When I look at this painting, I feel excited and a little bit scared. It looks like a giant, magical storm is coming to attack the village. The sky is swirling like a big wave in the ocean. The stars look like they are exploding!

I feel like a hero needs to come and save the people in the houses. The village is very dark and quiet, so they don't know the sky is turning into a monster. It feels like the start of a big adventure movie.",Burger,"whisper, fast winds"
1,10.0,4.0,2.0,5.0,2.0,2.0,3.0,20.0,0,1,0,1,0,0,0,1,1,1,1,1,1,1,Drowning in the endless night. Hopeless.,Spaghetti,"Flowing, piano-like"
1,1.0,2.0,4.0,5.0,1.0,3.0,4.0,1000000.0,0,0,0,1,1,0,1,1,1,1,1,1,0,1,Sleepy and calm,Blueberry cream filling,"It would be classical music. Twinkle twinkle little star, green sleeves, swan lake. Or something with Christmas vibes. Hark the angels sing."
1,7.0,1.0,4.0,5.0,1.0,2.0,1.0,400.0,0,1,0,0,1,0,1,1,0,0,0,1,1,1,Calm but also makes me want to take a long night walk in the city,pasta,maybe R&B type music
1,3.0,5.0,4.0,5.0,1.0,3.0,2.0,50.0,0,0,0,1,1,1,0,1,0,1,1,1,0,1,Calm and relaxed,Ice cream,"Something quiet, slow, and relaxing"
1,2.0,2.0,3.0,4.0,1.0,4.0,4.0,50.0,1,1,0,0,1,0,1,0,1,1,1,0,0,0,It makes me feel calm,pasta,a melodic summer soundtrack about the beach
1,8.0,3.0,4.0,4.0,3.0,4.0,5.0,1000.0,0,1,0,0,1,0,1,1,1,1,1,1,1,0,It giving me a peace of mind,Ice cream,A night in the farm
1,6.0,3.0,3.0,4.0,3.0,4.0,3.0,10.0,1,0,0,0,0,0,1,1,1,0,0,1,0,0,Calm,Pop Rock candy,Drifting sky
1,8.0,4.0,3.0,4.0,2.0,6.0,3.0,40.0,0,0,0,1,0,0,0,0,1,0,0,0,0,1,soothing,ice cream,calm music
1,5.0,2.0,4.0,4.0,2.0,2.0,2.0,50.0,0,0,0,1,0,0,0,1,0,0,0,0,0,1,"I am a really big fan of this painting, its so intricate and it makes me feel excited",blueberry pie,maybe like a calm beat soundtrack like lofi
1,7.0,2.0,3.0,4.0,3.0,4.0,2.0,150.0,0,0,0,1,1,0,1,1,0,1,1,1,0,0,"It makes me feel calm and thoughtful. The moving sky feels emotional, while the scene below feels quiet and peaceful.",blueberry pie,"It’d be soft and flowing, kinda emotional but calming. Slow music that drifts along and makes you feel thoughtful and peaceful."
1,7.0,3.0,4.0,5.0,3.0,20.0,20.0,150.0,0,0,1,0,0,1,0,0,0,0,0,1,0,0," 

* The composition suggests inner turmoil or heightened emotional states",something sweet like cake,something like classical 
1,9.0,2.0,4.0,5.0,2.0,3.0,1.0,100.0,0,0,1,1,0,0,0,0,1,1,1,1,1,1," it makes me feel small in a good way, calm but thoughtful, like staring at the sky when you’re tired and letting your mind wander.",warm bowl of soup with lots of spices.,"The soundtrack would be mostly slow and flowing. Low, sustained tones form a constant background. High, clear notes occasionally punctuate the space."
1,8.0,2.0,4.0,3.0,1.0,3.0,4.0,2000.0,0,0,0,1,1,0,0,1,0,0,0,0,1,1,"This painting seems to represent a city full of lights under the moonlight. It gives an energetic vibe and a feeling to just be out there with people to enjoy with some food, party and other activities. It also feels somewhat calm in the sense that the painting contains moonlight and some form of stars/planets which makes want to appreciate nature as it is. In general it feels like a modern piece which was drawn in the past.",Spicy Schezwan Fried Rice,Feels like an exciting pop music with high energy levels.
1,6.0,2.0,4.0,3.0,2.0,10.0,7.0,70.0,0,1,0,0,0,0,0,1,0,1,1,1,1,1,Makes me feel happy and free with all the stars and the swirls in the sky. ,French toast,Cool - Daniel Caeser
1,7.0,2.0,2.0,4.0,4.0,4.0,3.0,5000000.0,0,0,0,1,1,0,0,0,0,1,1,0,0,0,It makes me feel calm and restless in a state of turmoil at the same time. ,Marble cake,"The soundtrack would feel calm but lively at the same time. It’s peaceful enough to relax to, but always moving, giving you a sense of wonder and energy, like the world is quietly alive around you."
1,5.0,1.0,3.0,5.0,2.0,4.0,5.0,150.0,0,0,0,1,1,1,0,0,1,1,1,1,0,0,This painting makes me feel calm and sleepy.,It would be a blueberry muffin with a crispy outer layer.,It would be a calming classical soundtrack with no lyrics. 
1,7.0,4.0,2.0,4.0,5.0,3.0,4.0,400.0,0,0,0,1,0,1,0,1,0,0,0,1,1,1,"This painting makes me feel calm, yet evokes a sentiment of loneliness and some darkness.",On of those mixable yogurts with a blueberry jam at the bottom.,"A dark piano and orchestra classical piece with light snow-sounding effects. Should be like a vampire Dracula dark vibe, but with a light consistent background key pattern."
1,5.0,2.0,4.0,4.0,2.0,3.0,2.0,20.0,0,0,1,0,0,0,0,1,0,0,0,0,0,1,"This painting makes me feel cozy and content, because it is windy outside but everyone is warm in their houses, admiring the night sky.",freshly baked bread,
1,1.0,3.0,3.0,4.0,2.0,3.0,3.0,100.0,0,0,1,0,0,0,0,0,1,1,1,0,0,0,"Unrealistic, dream, dark.",chicken,"slow, pulsing low strings. With sound of winds but comforting while sadness."
1,10.0,2.0,5.0,5.0,4.0,3.0,3.0,100000.0,1,1,0,0,1,0,1,1,1,1,1,1,1,1,Makes me feel whimsical,soup,I can imagine something from a Tim Burton film 
1,7.0,3.0,3.0,4.0,3.0,1.0,3.0,1000000.0,0,1,0,0,0,0,0,1,1,1,0,0,0,1,It makes me feel peaceful and restful,Chocolate,a live jazz band that is elegant
1,7.0,4.0,1.0,4.0,3.0,3.0,3.0,100.0,0,0,1,1,1,1,1,1,0,1,1,0,0,1,"It makes me feel slightly sad, yet relaxed. It also makes me admire the painting.",Ice cream or water (if that's allowed),"The soundtrack is very sad and slow, with a sort of beat that makes one think back about their life and reflect. Maybe with some rain playing softly."
1,8.0,5.0,4.0,2.0,2.0,3.0,4.0,75.0,0,0,1,0,1,1,0,1,0,1,1,0,0,1,Makes me feel a cool breeze while I'm laying in bed trying to fall asleep,Cold noodles,A fast tempo with a consistent and boring repetition of the sound patterns
1,8.0,4.0,4.0,3.0,4.0,3.0,13.0,200.0,0,0,0,1,0,0,0,1,0,1,0,0,0,1,chaotic and confused,pasta,"chaotic, sad, and intense"
1,8.0,3.0,4.0,4.0,3.0,3.0,6.0,500.0,1,0,0,0,0,1,1,1,0,1,1,1,0,1,"Inspired, calm, quiet and still.",coffee,"A slow, soft piece with gently swirling melodies and long pauses that feels quiet."
1,1.0,3.0,3.0,4.0,2.0,2.0,3.0,10.0,0,0,0,1,1,0,1,1,1,1,0,1,0,0,Rather calm and collected. Nothing too emotion evoking in the painting.,Pizza,"Calming, sleeping music."
1,10.0,1.0,4.0,4.0,2.0,4.0,14.0,100.0,0,1,0,0,0,0,1,1,1,1,1,1,1,1,This painting exhibits feelings of grandiose and hopefulness; there is also an element of serenity.,Blueberries,"The soundtrack would sound like something from an adventurous movie, with hopeful tunes that eventually lead to a serene and melancholic symphony. It would end with some sort of grand finale."
1,8.0,4.0,5.0,4.0,1.0,5.0,4.0,100.0,0,0,1,0,1,0,0,1,1,0,0,0,0,1,"Fills me with awe, inspiration, appreciation for nature and beauty. It calms me and it feels serene and larger than life. Very satisfied feeling.",Blueberry White Chocolate Cheesecake,"Soft, quiet, personal, intimate piano melody with a brief little charming high point. Piano fades in and fades out at the start and end."
1,7.0,3.0,4.0,4.0,2.0,5.0,2.0,1000.0,0,1,0,1,1,0,0,0,0,1,0,0,0,0,this painting makes me feel calm,blueberry icecream,"rising strings, soft chimes, distant choir hums, and pulsing rhythms—calm underneath, but always moving, like a dream that won’t sit still."
1,7.0,4.0,3.0,4.0,2.0,3.0,3.0,80.0,0,0,0,1,1,1,1,1,0,1,1,0,0,1,"Silent, longing, a little apprehensive. Like something could suddenly happen, but also stuck in time.",Cold soup,"Slow and quiet. Homely feeling, maybe orchestral."
1,1.0,3.0,3.0,3.0,3.0,3.0,20.0,0.0,0,0,0,1,0,0,1,0,0,0,0,0,1,0,Tired,Blueberry,Quiet
1,2.0,2.0,3.0,4.0,3.0,4.0,4.0,200.0,0,1,0,0,1,1,0,1,0,1,1,0,0,1,imaginary,icecream,peaceful and quiet
1,8.0,2.0,4.0,4.0,3.0,3.0,8.0,300.0,1,1,0,1,1,1,0,1,1,1,1,1,1,1,It makes me feel a sense of awe and beauty,Ice cream,A nice relaxing flute or maybe some jazz
1,7.0,4.0,3.0,1.0,2.0,3.0,4.0,200000.0,0,1,0,0,1,0,1,1,0,1,1,1,0,1,Beautiful,Japanese cold noodles,"Peaceful, light piano"
1,10.0,1.0,5.0,5.0,2.0,4.0,4.0,100.0,1,0,0,1,1,1,1,1,1,1,1,1,1,1,"Mysterious, and relax",Warabi Mochi,锟斤拷烫烫烫锟斤拷烫烫烫锟斤拷烫烫烫锟斤拷烫烫烫锟斤拷烫烫烫锟斤拷烫烫烫锟斤拷烫烫烫锟斤拷烫烫烫锟斤拷烫烫烫锟斤拷烫烫烫锟斤拷烫烫烫锟斤拷烫烫烫锟斤拷烫烫烫锟斤拷烫烫烫锟斤拷烫烫烫锟斤拷烫烫烫锟斤拷烫烫烫锟斤拷烫烫烫
1,6.0,3.0,4.0,4.0,3.0,3.0,1.0,1000.0,1,0,0,1,0,1,0,1,0,0,1,1,0,0,Makes me feel like im in medieval times,Steak,Chill and calm similar to loft
1,9.0,5.0,5.0,5.0,2.0,3.0,2.0,500.0,1,1,1,0,1,0,0,0,0,1,1,1,1,0,nostalgic,hot chocolate,"bittersweet, longing, melancholic"
1,8.0,4.0,3.0,4.0,3.0,3.0,2.0,2000.0,0,0,0,1,1,0,0,1,0,1,1,1,0,1,gloomy and calm,blueberry smoothie bowl,"The soundtrack would start off with calm and windy sounds. Then, as the song progresses the sounds would get more intense."
1,7.0,4.0,4.0,5.0,2.0,3.0,3.0,0.0,0,1,0,1,1,0,1,1,0,1,1,0,0,1,This painting makes me feel very calm and it feels like if I took a psychedelic and went star gazing.,lucky charms cereal,"deux arabesques, the painting would sound very relaxing and calming. Stars would dance. "
1,5.0,3.0,3.0,4.0,2.0,3.0,3.0,20.0,0,1,0,1,1,0,0,0,0,1,1,1,1,1,Makes me feel creative and slightly sleeply.,Blueberry pie,"The sound track for this would be like a rythmic sound of the breeze of the wind. Combined with rythmic clicks of light switches, and the rumble of cars accelerating and decelerating. "
1,5.0,2.0,4.0,5.0,2.0,3.0,2.0,100.0,0,0,0,1,1,0,0,0,0,0,1,0,0,0,"This painting makes me feel calm and relaxed, while also filling me with a sense of awe and the vastness of the universe.",Ice Cream,"The soundtrack would be graceful and flowing, with a smooth and waltz-like rhythm."
1,5.0,2.0,3.0,3.0,1.0,6.0,5.0,400.0,0,1,0,0,1,0,1,1,0,1,1,1,1,1,"a child, dreaming, excited to see the future",Taro boba,"Exciting, lifting music"
1,9.0,1.0,4.0,5.0,2.0,9.0,15.0,100.0,1,1,0,0,1,0,1,1,1,1,1,1,1,1,"It makes me feel calm, in wonder, serene.",Fettuccine.,"String orchestra music, slow jazz, romantic."
1,8.0,3.0,4.0,5.0,1.0,2.0,1.0,100.0,0,0,1,1,0,0,0,1,0,1,1,1,0,1,Calm and sacred,blueberry ice cream,"8 bit music, sharp and exaggerating"
1,6.0,3.0,4.0,4.0,1.0,2.0,7.0,500.0,0,1,0,0,1,0,1,0,0,1,1,0,0,0,After seeing that last image: hopeful,Icecream ,"It's giving ""Title Screen Music"" from Sheepy. So calm, quiet and slightly uplifting, a little sombre. "
1,10.0,4.0,4.0,5.0,2.0,3.0,3.0,100.0,1,1,0,0,1,0,0,1,1,1,1,0,0,1,Breathless,Steak,Exciting
1,5.0,4.0,4.0,4.0,1.0,3.0,4.0,50.0,0,1,0,0,1,0,0,1,1,1,1,0,0,1,It makes me feel cam as if I am viewing a starry night myself.,"It would be berries, more specifically blueberries because they have one or 2 colours usually (green and blue).",A galatic kind of music sort of llike the Celeste title screen.
1,7.0,1.0,5.0,5.0,1.0,2.0,4.0,100.0,0,1,0,0,1,0,0,1,0,1,1,0,0,0,"wonder, calmness, nostalgia, peace",Dark chocolate,"Twinkling bell sounds, luscious strings, harp, flutes, woodwinds"
1,7.0,4.0,3.0,2.0,4.0,3.0,2.0,8.0,0,0,0,1,0,0,0,0,1,1,0,0,0,0,"It makes me feel both calm and restless at the same time. The movement feels intense and emotional, but there’s also a sense of wonder and quiet reflection.",ice cream ,"The soundtrack would be fast and flowing, with rising and falling melodies that feel emotional and dramatic. It would sound intense but also hopeful, like constant motion that never fully settles."
1,8.0,4.0,2.0,5.0,2.0,2.0,4.0,10.0,0,0,0,1,0,0,0,0,1,1,0,0,0,0,It makes me feel calm.,Pizza,Soothing humming birds.
1,9.0,3.0,4.0,4.0,2.0,5.0,6.0,100.0,0,0,1,1,0,0,1,1,1,1,1,1,0,0,confused,cheese,non diegetic
1,7.0,2.0,4.0,3.0,2.0,3.0,3.0,30.0,0,1,0,1,1,1,1,1,1,1,0,1,0,0,Awe,Beavertail,"Mellow, soft, spacey/distorted notes"
1,6.0,2.0,4.0,5.0,1.0,3.0,4.0,50.0,0,0,1,0,0,0,0,1,0,1,1,0,0,0,"Chilly, would make me want to go outside for a night walk. ",Icecream,"Shoegaze kind of song, indie pop. "
1,10.0,3.0,4.0,5.0,1.0,3.0,1.0,100.0,0,0,0,1,1,0,0,0,0,0,1,0,0,0,"makes me feel nostalgic. I have a very similar, if not the exact same painting at home which my grandpa gave me. So i’m super nostalgic. ",burger ,it feels like a bunch of rap music (my favourite music) since i love this painting.
1,9.0,3.0,2.0,3.0,2.0,4.0,5.0,100000.0,0,1,0,0,1,0,0,0,0,0,0,0,0,1,Somewhere in between nostalgia and internal stress,"a slightly burnt marshmallow (a bit sad, a bit tainted, but still tastes really good)","Lot's of violin, occasionally frantic"
1,6.0,4.0,4.0,3.0,3.0,3.0,14.0,1000000.0,0,0,0,1,1,0,1,1,0,1,1,1,1,1,It fascinates me and instills both a sense of calmness and doubt in me.,Blueberry ice cream,"The soundtrack would be a calm classical piece, using violins and a piano in the background."
1,6.0,1.0,4.0,4.0,1.0,3.0,3.0,300.0,0,0,0,1,1,0,1,1,1,1,1,0,0,1,"awe-inspired, amazed",hot chocolate,"there is no soundtrack, just a silent cold breeze"
1,7.0,2.0,4.0,4.0,3.0,2.0,3.0,35.0,0,0,1,1,1,0,0,0,0,0,0,0,1,1,"Awestruck, melancholic, and hopeful",Brown sugar apple porridge,"instrumental, quiet and melancholic."
1,7.0,5.0,3.0,2.0,4.0,3.0,2.0,50.0,0,0,1,0,1,0,0,1,0,1,0,1,0,0,It makes me feel like I am travelling through a windy forest at night.,Chicken noodle soup,Windy background noise
1,8.0,1.0,5.0,4.0,1.0,3.0,2.0,50.0,1,0,0,0,1,0,0,0,0,0,0,0,0,1,it makes me think about the stars,ice cream,it would have bells
1,2.0,3.0,4.0,4.0,1.0,5.0,3.0,10.0,0,0,0,1,1,0,0,0,0,1,0,0,0,0,Calm,spaghetti,It would be an ambient soundtrack with the sounds of wind and calm instruments. 
1,6.0,4.0,2.0,3.0,3.0,3.0,2.0,75.0,1,1,0,0,0,0,0,1,1,1,1,1,0,1,sad and dizzy ,bread,"calm, slow, and orchestral "
1,5.0,1.0,3.0,4.0,2.0,3.0,2.0,200.0,1,0,0,0,0,1,0,0,0,1,1,0,0,0,"Makes me feel excited because of the movement of the sky,",smoked salmon,up beat classical music
1,10.0,3.0,1.0,2.0,4.0,5.0,2.0,10000.0,0,0,0,1,1,1,1,1,1,1,0,0,0,1,Sad,Ice,"Quiet, flute, mellow"
1,9.0,5.0,5.0,5.0,1.0,8.0,14.0,50.0,1,1,0,1,1,0,1,1,0,1,1,1,0,1,"Calm, serene, a little longing.","Fresh, warm blueberry pie","Peaceful, gentle chirping of night bugs and a refreshing breeze"
1,6.0,2.0,3.0,4.0,1.0,4.0,4.0,125.0,0,0,0,1,1,0,0,0,0,1,0,0,0,0,"its giving -- go with the flow vibes. Mysterious - in dramatic way., some murder investigation in that town perhaps?",blue cheese!!,"Angel by Massive Attack, Horace Andy.. (the mysterious James-Bond vibes)"
1,6.0,4.0,2.0,3.0,4.0,3.0,3.0,10.0,0,0,0,1,0,0,0,1,0,0,0,0,0,1,It makes me feel a bit sad. It kind of reminds me of the night time but like a sombre version of it. ,Oh it kind of reminds me of purple grapes. I think the reason why is due to how it is displaying its take on night time. ,"I feel like the soundtrack for this painting would be like in the sombre blues genre. Because I feel like that is the best type of music that would display the dreary night time this painting is displaying. I don't think there would be any changes in type of song, I feel like the would all be sombre blues. "
1,10.0,5.0,5.0,5.0,1.0,4.0,3.0,50.0,0,0,0,1,1,0,0,0,0,0,0,0,0,1,"Overall, very calm, but with a sense of yearning for something more. Maybe a slight nostalgia",Ice cream,Just nature sounds. Like a soft wind flowing through trees. You can hear the movement of the branches. It's sounds cold and quiet.
1,9.0,2.0,4.0,5.0,1.0,3.0,4.0,40.0,1,0,0,1,1,0,0,1,1,1,1,0,0,1,It makes me feel the peaceful nights,blue icecream,quiet ambience and some small violin
1,8.0,1.0,5.0,3.0,1.0,3.0,2.0,100.0,0,0,0,1,1,0,0,0,0,1,1,1,1,0,i love this painting! it makes me happy and content,bluberries,"quiet, calming, ambience"
1,5.0,3.0,2.0,5.0,3.0,2.0,2.0,300.0,0,1,0,0,1,0,0,0,1,1,1,0,0,0,This painting makes me feel calm.,A salad.,Calm jazzy music with piano.
1,10.0,1.0,5.0,5.0,1.0,5.0,3.0,100.0,0,1,0,0,1,0,0,0,0,0,0,0,0,1,it makes me wonder about the beauty of the world.,it would be chocolate parfait.,it would be soothing and calm.
1,8.0,4.0,4.0,5.0,4.0,4.0,20.0,100.0,0,0,0,1,0,0,1,1,1,1,1,1,1,1,This painting makes me feel calm yet mildly perturbed. Like the weather is just barely too cold for comfort yet still not cold enough for you to want to leave.,pesto fettucine,a slow piece with in a minor key. occasional gusts of speed.
1,9.0,4.0,5.0,3.0,2.0,4.0,6.0,100.0,0,0,0,1,1,0,0,1,1,1,1,0,0,1,Insignificant,Blue Berry Ice Cream,Calm violin with an assortment of deep sounding band instruments
1,5.0,2.0,3.0,4.0,2.0,3.0,4.0,5000.0,0,0,1,1,1,0,0,1,0,1,1,0,1,1,"I feel mysterious within the painting, and brings me curiosity and hopeful feelings.",octopus,mysterious piano music
1,9.0,4.0,4.0,5.0,2.0,3.0,2.0,1000.0,0,1,0,0,0,0,1,1,1,1,1,1,0,0,It makes me feel calm at during night time,Croissant,Calm Chill music playing when your driving late at night
1,10.0,2.0,4.0,2.0,1.0,3.0,4.0,1000.0,0,1,0,1,1,0,0,1,1,1,1,0,0,0,"It makes me feel peaceful but emotional. Calm, inspired, and a little overwhelmed in a beautiful way.",A warm blueberry tart or a rich dark-chocolate dessert.,"A flowing, orchestral piece with rising and falling strings. Slow at first, then swelling with energy. Emotional, dreamy, and full of motion"
1,9.0,1.0,5.0,2.0,4.0,3.0,3.0,1000.0,0,1,0,1,1,0,0,1,1,1,0,0,0,0,nervous and mysterious,Blueberry Lemon Swirl Mousse Cake,Swirling strings with deep resonance and ethereal choir
1,4.0,2.0,2.0,5.0,2.0,2.0,2.0,40.0,0,0,0,1,0,1,1,0,0,1,1,0,0,1,interested,spaghetti,songs with very loud trumpets 
1,6.0,2.0,4.0,5.0,1.0,3.0,3.0,50.0,0,1,0,0,1,0,0,0,0,0,0,0,0,1,"easy, clam",soba noodle,clam and relaxing lofi
1,9.0,3.0,4.0,3.0,2.0,6.0,5.0,10.0,0,1,0,0,1,0,0,0,0,0,0,0,0,1,"This painting makes me feel emotionally stirred and slightly unsettled, as if I’m witnessing the world through heightened senses.","It would be like a rich, intensely spiced stew: deep, dark flavors layered with sudden bursts of brightness.","The soundtrack would be driven by sweeping, restless motion rather than a steady beat. "
1,7.0,4.0,3.0,4.0,2.0,4.0,3.0,100.0,0,0,1,1,1,0,0,0,0,1,1,1,0,1,It makes me feel sleepy.,shepherd's pie,"It would be calm with a classical tone, and it would have a lower vibe to it, not a lot of ups and downs."
1,8.0,3.0,2.0,2.0,4.0,4.0,4.0,1000000.0,0,1,0,0,0,0,0,1,0,0,0,1,0,0,"turmoil, calm, mixed emotions, storm is coming, ominous, anticipation, preparation, concern, awe, amazement, shock, peace, serenity",hot latte,"orchestral, piano, high pace, high volume, fortissimo, presto, vivace, string quartet, grandiose, archipelagos"
1,6.0,2.0,2.0,2.0,1.0,3.0,2.0,30.0,0,0,0,1,1,0,0,0,0,0,0,0,0,1,"wonder, curious, distant, excited",Astronaut food tubes.,"Fast paced with slower sections, orchestra. classical."
1,7.0,2.0,4.0,4.0,2.0,5.0,13.0,5000.0,1,1,0,0,1,0,0,1,0,1,1,0,0,0,"Hopeful, intrigued, dreamy",Cosmic brownies,It would be a wondrous but slow tune
1,5.0,4.0,4.0,4.0,2.0,4.0,3.0,550.0,1,0,0,0,0,1,1,0,0,1,0,0,0,0,Optimistic,Blueberry Ice Cream,"Smooth flow, maracas in the background, lots of natural ambiance "
1,7.0,4.0,4.0,2.0,2.0,3.0,3.0,100.0,1,0,0,0,0,0,0,1,1,1,1,0,0,0,"this painting is a bit more complex than the last one. Some of the feelings it invokes is sombreness, calmness and peaceful.",blueberries,melancholy 
1,3.0,4.0,2.0,4.0,1.0,2.0,3.0,1.0,0,0,0,1,0,0,0,1,1,0,1,1,1,0,This painting makes me feel a bit bored because the painting's a classic and I've seen it many times. It also makes me feel a bit chilly or a bit cold on the inside. It's not my favourite painting. I like the swirls and the different blues. ,Blueberries ,Something slow. Sad or emo. electric Guitar. 
1,10.0,1.0,5.0,4.0,1.0,3.0,2.0,100.0,0,1,0,0,1,0,0,1,0,0,0,0,0,1,Awe,Ice Cream,Debussy - Clair de Lune
1,6.0,4.0,4.0,4.0,2.0,3.0,3.0,250.0,0,0,0,1,1,0,0,0,0,0,1,0,0,1,"Very nostalgic, out in the country vibes.",croissant ,"A woozy song, very relaxed song, nostalgic song."
1,5.0,2.0,4.0,4.0,2.0,3.0,11.0,10000.0,1,0,0,1,1,0,1,1,1,1,0,0,0,1,"This painting makes me feel peaceful but also a little calm. The bright, swirling sky feels full of energy, like the world is alive and moving, even at night.",Steak,"It would sound like a soft, dreamy song with slow piano and gentle strings, but with a little restless energy underneath, calm, emotional, and slightly overwhelming, like late, night thoughts."
1,6.0,2.0,4.0,4.0,1.0,5.0,3.0,10000.0,0,1,0,0,1,0,0,0,0,1,1,0,0,1,"whimsical, magical, appreciative of nighttime, peaceful",salad,"chimes, whimsical, floaty, smooth piano"
1,9.0,3.0,4.0,5.0,2.0,4.0,3.0,100.0,0,0,1,0,1,0,0,0,0,1,1,0,0,0,"Feels calm, peaceful. It reminds me of how beautiful the night sky is when there are less light pollution.",Hot clear soup (Like pho),"Magical, dreamy, twinkling, mysterious, quiet and the noise or melody would be like robotic/alien."
